{
  "$schema": "./llamacpp-upstream-releases-schema.json",
  "schema_version": 1,
  "updated_at": "2026-10-19T17:40:28Z",
  "upstream_repo": "ggml-org/llama.cpp",
  "download_base": "https://github.com/AtomicBot-ai/atomic-chat-conf/releases/download",
  "releases": [
    {
      "tag": "b11734",
      "commit": "f3fb2fcdbc93a8f677e893b8dbd36462b3190ffd",
      "published_at": "2026-10-19T14:08:40Z",
      "min_core_version": "0.18.2",
      "notes_url": "https://github.com/ggml-org/llama.cpp/releases/tag/b11734",
      "assets": [
        {
          "name": "llama-b11734-bin-macos-arm64.tar.gz",
          "sha256": "dae3bfe38a913b6d24f71331eaa907140430e7508ae91ac3b9f0d71c69f169b3",
          "size": 12376611,
          "validation": "approved"
        },
        {
          "name": "llama-b11734-bin-ubuntu-arm64.tar.gz",
          "sha256": "29f2c5bb869e60ff25848d8f8b3b34dbe1b924c2266d4f54ee84c1106f148b23",
          "size": 14023345,
          "validation": "approved"
        },
        {
          "name": "llama-b11734-bin-ubuntu-cuda-13.4-arm64.tar.gz",
          "sha256": "63b491838ba26dbacd884ebcef20231904e927a73531f4e5aeb50098b45c10f4",
          "size": 149745502,
          "validation": "approved"
        },
        {
          "name": "llama-b11734-bin-ubuntu-vulkan-arm64.tar.gz",
          "sha256": "b48290f40c1590c387fc72af7f62059dd3fb02b8fec7a5f9fa575eb1dc7b2b0e",
          "size": 24309561,
          "validation": "approved"
        },
        {
          "name": "llama-b11734-bin-ubuntu-vulkan-x64.tar.gz",
          "sha256": "2c8b590c325960eb474c08c7a3b02b3c8eda054aa03352ed864948dc4ae1668d",
          "size": 30615743,
          "validation": "approved"
        },
        {
          "name": "llama-b11734-bin-ubuntu-x64.tar.gz",
          "sha256": "5d20cbcde04ef743b96e91b6173663b1925077a13fa86d0d98e69a5a5b59a16a",
          "size": 17973484,
          "validation": "approved"
        },
        {
          "name": "llama-b11734-bin-win-cpu-arm64.zip",
          "sha256": "18fadd0252b8a2919590253876d233ec01b4681b1c3f62bc6d4e71fd8ee82fe9",
          "size": 10697598,
          "validation": "approved"
        },
        {
          "name": "llama-b11734-bin-win-cpu-x64.zip",
          "sha256": "084d969c4076a03886b753612b5d9a6c67f2666bdf7fa8784c093d8f8857ce84",
          "size": 17851374,
          "validation": "approved"
        },
        {
          "name": "llama-b11734-bin-win-cuda-12.4-x64.zip",
          "sha256": "54307edf39eecc3031f496607d740d1d3a840cac15fc91e0b8aa7116dcfa487f",
          "size": 265122713,
          "validation": "approved"
        },
        {
          "name": "llama-b11734-bin-win-cuda-13.4-arm64.zip",
          "sha256": "7a6b7ea17d2ab643b1da2956e1e273c2fbf809ca2160b9525913b668e668a724",
          "size": 145209435,
          "validation": "approved"
        },
        {
          "name": "llama-b11734-bin-win-cuda-13.4-x64.zip",
          "sha256": "1e4f2c77b11437ad7a2865bac1d29a7c1dd65747a8a793be046dcba07dd7f175",
          "size": 152756701,
          "validation": "approved"
        },
        {
          "name": "llama-b11734-bin-win-opencl-adreno-arm64.zip",
          "sha256": "bdbb4553f9403273f7f2700cfee65e44982c22a828b48a1f1664fcad608cdb41",
          "size": 11265988,
          "validation": "approved"
        },
        {
          "name": "llama-b11734-bin-win-rocm-10.0-x64.zip",
          "sha256": "05db2bd3bf5a5fd811d383884539758957c9102fc6fba7d757624a7b669d3cfa",
          "size": 256471800,
          "validation": "approved"
        },
        {
          "name": "llama-b11734-bin-win-vulkan-x64.zip",
          "sha256": "8fb811df07311c2acecd365060cfe90cebfdd540f7035477ca30ffd377759de5",
          "size": 29929790,
          "validation": "approved"
        }
      ]
    },
    {
      "tag": "b11463",
      "commit": "d2a79e60464903f9832fbecdba48bd4cc6c47e75",
      "published_at": "2026-10-07T10:40:25Z",
      "min_core_version": "0.0.0",
      "notes_url": "https://github.com/ggml-org/llama.cpp/releases/tag/b11463",
      "assets": [
        {
          "name": "llama-b11463-bin-macos-arm64.tar.gz",
          "sha256": "5fcb0237a9a6d247acfb91792249dde498e3f2231ed62a62851c5ca83eb230df",
          "size": 12087702,
          "validation": "approved"
        },
        {
          "name": "llama-b11463-bin-ubuntu-arm64.tar.gz",
          "sha256": "95e17be13037fafbed43c7afd75230ce04defb941d066062d0aff4bb3d52caf4",
          "size": 13724995,
          "validation": "approved"
        },
        {
          "name": "llama-b11463-bin-ubuntu-cuda-13.4-arm64.tar.gz",
          "sha256": "6a7580834b0679e02ad17da07905bba9fbb50c5dd04dbe1e3b95e518c536aa66",
          "size": 147667327,
          "validation": "approved"
        },
        {
          "name": "llama-b11463-bin-ubuntu-vulkan-arm64.tar.gz",
          "sha256": "b3a97c347ef9284f8a82f433679f2daaa10310816affaaa99c94fb449f086698",
          "size": 24887749,
          "validation": "approved"
        },
        {
          "name": "llama-b11463-bin-ubuntu-vulkan-x64.tar.gz",
          "sha256": "5d428312d97e4c25eb28277416de935a76ca80bf7ede6b418d43a2b10c0336cd",
          "size": 31678494,
          "validation": "approved"
        },
        {
          "name": "llama-b11463-bin-ubuntu-x64.tar.gz",
          "sha256": "c7d63a3dfd1fe93a679b4bcd981dacb9153e2509a21bb912b9a01fc28a8447f5",
          "size": 17732486,
          "validation": "approved"
        },
        {
          "name": "llama-b11463-bin-win-cpu-arm64.zip",
          "sha256": "3c0d239d4573b2dfda51d6832327114a78bf9913300efdec44a535f79cd6d2b2",
          "size": 10424801,
          "validation": "approved"
        },
        {
          "name": "llama-b11463-bin-win-cpu-x64.zip",
          "sha256": "61fa0338763addfe9e7e71fca1f0fdd2ee8b636abf016bae167aab7973a13728",
          "size": 17636283,
          "validation": "approved"
        },
        {
          "name": "llama-b11463-bin-win-cuda-12.4-x64.zip",
          "sha256": "648a85ead292c019483371055c7d727f37da6f8db6948db50c62870b2da31900",
          "size": 262157599,
          "validation": "approved"
        },
        {
          "name": "llama-b11463-bin-win-cuda-13.4-arm64.zip",
          "sha256": "cc2bbfef79a2d7966cdaa18f5d3a95ea4dd0a27baa003ca0c1b4b4f7dba89c5b",
          "size": 143195817,
          "validation": "approved"
        },
        {
          "name": "llama-b11463-bin-win-cuda-13.4-x64.zip",
          "sha256": "e935758fab193361452f001f1e487d216e709b8550e92b7e9228be5e23bd3d34",
          "size": 150767155,
          "validation": "approved"
        },
        {
          "name": "llama-b11463-bin-win-opencl-adreno-arm64.zip",
          "sha256": "5065296d71ac9508aa19189c29198b0a9bc368de8f17496063cf0191fe9c3bc3",
          "size": 10983603,
          "validation": "approved"
        },
        {
          "name": "llama-b11463-bin-win-rocm-10.0-x64.zip",
          "sha256": "981dcee4c9902523a627217d3a57875e805d43b2faddd6b01dc08a034d3ebbbe",
          "size": 254658682,
          "validation": "approved"
        },
        {
          "name": "llama-b11463-bin-win-vulkan-x64.zip",
          "sha256": "c951fef0f0158bf4b6d8aa75c99a6209658bcbe75fd349d6d2b1b08672933a35",
          "size": 31007237,
          "validation": "approved"
        }
      ]
    }
  ]
}
